{
  "$schema": "https://json-schema.org/draft/2020-12/schema",
  "title": "Batai Task",
  "type": "object",
  "required": [
    "id",
    "created_by",
    "objective",
    "assigned_to",
    "status"
  ],
  "properties": {
    "id": {
      "type": "string"
    },
    "created_by": {
      "type": "string"
    },
    "objective": {
      "type": "string"
    },
    "assigned_to": {
      "type": "array",
      "items": {
        "type": "string"
      },
      "minItems": 1
    },
    "dependencies": {
      "type": "array",
      "items": {
        "type": "string"
      }
    },
    "acceptance_criteria": {
      "type": "array",
      "items": {
        "type": "string"
      }
    },
    "inputs": {
      "type": "array",
      "items": {
        "type": "string"
      }
    },
    "outputs": {
      "type": "array",
      "items": {
        "type": "string"
      }
    },
    "status": {
      "enum": [
        "PENDING",
        "READY",
        "RUNNING",
        "BLOCKED",
        "WAITING_RESOURCE",
        "REVIEW",
        "COMPLETED",
        "FAILED",
        "CANCELLED"
      ]
    },
    "execution": {
      "type": "object",
      "properties": {
        "parallel": {
          "type": "boolean"
        },
        "requires_director_review": {
          "type": "boolean"
        }
      }
    },
    "on_success": {
      "type": "object"
    },
    "on_failure": {
      "type": "object"
    }
  }
}